{
  "schema_version": "1.0.0",
  "document_id": "15-10-greffe",
  "source_file": "15-10-greffe__p001.png",
  "generated_at": "2026-09-11T09:19:43.904979Z",
  "ocr_engine": {
    "name": "PP-StructureV3",
    "version": "3.7.0"
  },
  "page_count": 1,
  "pages": [
    {
      "page_number": 1,
      "width": 1654,
      "height": 2339,
      "orientation": 0,
      "blocks": [
        {
          "block_id": "p1_b0",
          "type": "header",
          "text": "Facture 2025FA0527157",
          "bbox": [
            130.0,
            217.0,
            344.0,
            238.0
          ],
          "ocr_confidence": 0.9998770952224731,
          "reading_order": 0,
          "polygon": [
            [
              130.0,
              217.0
            ],
            [
              344.0,
              217.0
            ],
            [
              344.0,
              238.0
            ],
            [
              130.0,
              238.0
            ]
          ]
        },
        {
          "block_id": "p1_b1",
          "type": "text",
          "text": "15/10",
          "bbox": [
            686.0,
            334.0,
            843.0,
            397.0
          ],
          "ocr_confidence": 0.9999078512191772,
          "reading_order": 1,
          "polygon": [
            [
              686.0,
              334.0
            ],
            [
              843.0,
              334.0
            ],
            [
              843.0,
              397.0
            ],
            [
              686.0,
              397.0
            ]
          ]
        },
        {
          "block_id": "p1_b2",
          "type": "image",
          "text": "GREFFE DU TRIBUNAL DES",
          "bbox": [
            253.0,
            434.0,
            502.0,
            456.0
          ],
          "ocr_confidence": 0.9843801259994507,
          "reading_order": 2,
          "polygon": [
            [
              254.0,
              434.0
            ],
            [
              502.0,
              435.0
            ],
            [
              502.0,
              456.0
            ],
            [
              253.0,
              455.0
            ]
          ]
        },
        {
          "block_id": "p1_b3",
          "type": "image",
          "text": "ACTIVITES ECONOMIQUES",
          "bbox": [
            252.0,
            453.0,
            503.0,
            478.0
          ],
          "ocr_confidence": 0.999116063117981,
          "reading_order": 3,
          "polygon": [
            [
              253.0,
              453.0
            ],
            [
              503.0,
              454.0
            ],
            [
              503.0,
              478.0
            ],
            [
              252.0,
              477.0
            ]
          ]
        },
        {
          "block_id": "p1_b4",
          "type": "image",
          "text": "DE PARIS",
          "bbox": [
            332.0,
            472.0,
            423.0,
            496.0
          ],
          "ocr_confidence": 0.9429810047149658,
          "reading_order": 4,
          "polygon": [
            [
              332.0,
              472.0
            ],
            [
              423.0,
              475.0
            ],
            [
              422.0,
              496.0
            ],
            [
              332.0,
              493.0
            ]
          ]
        },
        {
          "block_id": "p1_b5",
          "type": "text",
          "text": "1, QUAI DE LA CORSE - PASQUALE PAOLI",
          "bbox": [
            268.0,
            501.0,
            487.0,
            515.0
          ],
          "ocr_confidence": 0.9687824249267578,
          "reading_order": 5,
          "polygon": [
            [
              268.0,
              501.0
            ],
            [
              487.0,
              501.0
            ],
            [
              487.0,
              515.0
            ],
            [
              268.0,
              515.0
            ]
          ]
        },
        {
          "block_id": "p1_b6",
          "type": "image",
          "text": "75198 PARIS CEDEX 04",
          "bbox": [
            317.0,
            515.0,
            437.0,
            529.0
          ],
          "ocr_confidence": 0.9954602122306824,
          "reading_order": 6,
          "polygon": [
            [
              317.0,
              515.0
            ],
            [
              437.0,
              515.0
            ],
            [
              437.0,
              529.0
            ],
            [
              317.0,
              529.0
            ]
          ]
        },
        {
          "block_id": "p1_b7",
          "type": "text",
          "text": "AMBULANCES PARIS-BERCY",
          "bbox": [
            906.0,
            564.0,
            1268.0,
            593.0
          ],
          "ocr_confidence": 0.9997567534446716,
          "reading_order": 7,
          "polygon": [
            [
              907.0,
              564.0
            ],
            [
              1268.0,
              565.0
            ],
            [
              1268.0,
              593.0
            ],
            [
              906.0,
              592.0
            ]
          ]
        },
        {
          "block_id": "p1_b8",
          "type": "text",
          "text": "14 R DES BOULETS",
          "bbox": [
            907.0,
            595.0,
            1159.0,
            622.0
          ],
          "ocr_confidence": 0.9995650053024292,
          "reading_order": 8,
          "polygon": [
            [
              907.0,
              595.0
            ],
            [
              1159.0,
              595.0
            ],
            [
              1159.0,
              622.0
            ],
            [
              907.0,
              622.0
            ]
          ]
        },
        {
          "block_id": "p1_b9",
          "type": "text",
          "text": "75011 PARIS",
          "bbox": [
            907.0,
            625.0,
            1079.0,
            652.0
          ],
          "ocr_confidence": 0.9998491406440735,
          "reading_order": 9,
          "polygon": [
            [
              907.0,
              625.0
            ],
            [
              1079.0,
              625.0
            ],
            [
              1079.0,
              652.0
            ],
            [
              907.0,
              652.0
            ]
          ]
        },
        {
          "block_id": "p1_b10",
          "type": "text",
          "text": "Paris, le 29 octobre 2025,",
          "bbox": [
            147.0,
            743.0,
            479.0,
            774.0
          ],
          "ocr_confidence": 0.9866384863853455,
          "reading_order": 10,
          "polygon": [
            [
              147.0,
              743.0
            ],
            [
              479.0,
              746.0
            ],
            [
              479.0,
              774.0
            ],
            [
              147.0,
              771.0
            ]
          ]
        },
        {
          "block_id": "p1_b11",
          "type": "text",
          "text": "Facture n° 2025FA0527157 (clé 0547157)",
          "bbox": [
            147.0,
            803.0,
            715.0,
            834.0
          ],
          "ocr_confidence": 0.9822580218315125,
          "reading_order": 11,
          "polygon": [
            [
              147.0,
              803.0
            ],
            [
              715.0,
              806.0
            ],
            [
              715.0,
              834.0
            ],
            [
              147.0,
              831.0
            ]
          ]
        },
        {
          "block_id": "p1_b12",
          "type": "text",
          "text": "Référence à reporter pour toute",
          "bbox": [
            147.0,
            833.0,
            601.0,
            864.0
          ],
          "ocr_confidence": 0.9979208707809448,
          "reading_order": 12,
          "polygon": [
            [
              147.0,
              833.0
            ],
            [
              601.0,
              837.0
            ],
            [
              601.0,
              864.0
            ],
            [
              147.0,
              860.0
            ]
          ]
        },
        {
          "block_id": "p1_b13",
          "type": "text",
          "text": "correspondance et règlement",
          "bbox": [
            148.0,
            868.0,
            566.0,
            892.0
          ],
          "ocr_confidence": 0.9970716834068298,
          "reading_order": 13,
          "polygon": [
            [
              148.0,
              868.0
            ],
            [
              566.0,
              868.0
            ],
            [
              566.0,
              892.0
            ],
            [
              148.0,
              892.0
            ]
          ]
        },
        {
          "block_id": "p1_b14",
          "type": "text",
          "text": "Article",
          "bbox": [
            145.0,
            943.0,
            236.0,
            975.0
          ],
          "ocr_confidence": 0.9997066259384155,
          "reading_order": 14,
          "polygon": [
            [
              145.0,
              943.0
            ],
            [
              236.0,
              943.0
            ],
            [
              236.0,
              975.0
            ],
            [
              145.0,
              975.0
            ]
          ]
        },
        {
          "block_id": "p1_b15",
          "type": "text",
          "text": "Réf.",
          "bbox": [
            1088.0,
            945.0,
            1145.0,
            976.0
          ],
          "ocr_confidence": 0.9964306950569153,
          "reading_order": 15,